ID,Title
368605,A Generalizing Adaptive Discriminant Network.
368657,Categorical perception of emotional facial expressions: Computer models and human performance.
370366,From data distributions to regularization in invariant learning.
372862,Lookahead and discretization in ILP.
375605,Computer evolution of buildable objects.
375825,Double censoring: characterization and computation of the nonparametric maximum likelihood estimator.
376704,Learning to classify observed motor behavior.
377303,Evolving deterministic finite automata using cellular encoding.
379288,"""Protein Sequencing Experiment Planning Using Analogy,"""
380341,A hybrid projection proximal point algorithm.
384428,Algebraic transformations of objective functions.
385067,CBR for Document Retrieval The FAllQ Project.
385251,"Application of Quantum Mechanical Properties to Machine Learning,"
385572,Individual and collective prognostic prediction.
387795,Design strategies for evolutionary robotics.
389715,Constructing nominal X-of-N attributes.
390693,Neural networks with real weights: analog computational complexity.
390889,(in press). A hierarchical community of experts.
390894,Jordan (1996). A variational approach to Bayesian logistic regression problems and their extensions.
390896,(in press). Improving the mean field approximation via the use of mixture distributions.
390922,(in press). A mean field learning algorithm for unsupervised neural networks.
395075,Evolving neural networks with collaborative species.
395540,Maximum likelihood and covariant algorithms for independent component analysis.
395547,"Computation and Neural Systems,"
395553,Mixtures of probabilistic principle component analysers.
395725,Plate. Distributed Representations and Nested Compositional Structure.
396412,Efficient learning in Boltzmann Machines using linear response theory.
397488,Fast equi-partitioning of rectangular domains using stripe decomposition.
397590,"""Inverting Implication with Small Training Sets"","
399173,"Corporate memories as distributed case libraries. Submitted to CORPORATE MEMORY & ENTERPRISE MODELING track in KAW\'96,"
399339,Comparison of action selection learning methods.
399370,A portable parallel programming language for artificial neural networks.
400356,"""Factor analysis using delta-rule wake-sleep learning"","
400455,Categorical perception in facial emotion classification.
400473,Ring. Sequence learning with incremental higher-order neural networks.
408885,A collection of algorithms for belief networks.
409255,"""Stabilization with saturated actuators, a worked example: F-8 longitudinal flight control,"""
409725,A global unified resource requirements represen-tations.
411005,Guessing can outperform many long time lag algorithms.
411092,Learning Logical Exceptions in Chess.
415693,Using real-valued genetic algorithms to evolve rule sets for classification.
416455,Robo-shepherd: Learning complex robotic behaviors.
416867,On the Power of Equivalence Queries.
416964,"Distributed Patterns as Hierarchical Structures,"
417017,Relating relational learning algorithms.
421481,Bootstrapping functional M-estimators.
423463,"and Sylvia Richardson (1995). Model selection for generalized linear models via GLIB, with application to epidemiology. In Bayesian Biostatistics (D.A."
423816,"Minimum-perimeter domain assignment,"
424540,"Some canonical properties of nonlinear systems, in Robust Control of Linear Systems and Nonlinear Control, M.A. Kaashoek,"
427606,Biological Metaphor and the design of modular artificial neural networks.
428610,"`Time series prediction using mixtures of experts,\'"
429781,Mistake-driven learning in text categorization.
429805,Resolving pp attachment ambiguities with memory based learning.
430329,"Kalman, An Adaptive Neural Network Parser,"
430574,Nonlinear resonance in neuron dynamics.
430711,A mixture of experts model exhibiting prosopag--nosia.
431206,Backfitting in smoothing spline ANOVA with application to historical global temperature data (thesis).
436796,Some extensions of the k-means algorithm for image segmentation and pattern classification.
440815,(1994) Change point and change curve modeling in stochastic processes and spatial statistics.
444191,(1994) Automatic smoothing spline projection pursuit.
444240,PLEASE: A prototype learning system using genetic algorithms.
445938,Compositional modeling with dpns.
446271,Mapping Bayesian networks to Boltzmann machines.
446610,Coupled hidden markov models for modeling interacting processes.
447224,(1996) A compression algorithm for probability transition matrices.
447250,"""Introduction to radial basis function networks"","
449841,"""Theory-Guided Induction of Logic Programs by Inference of Regular Languages"","
458439,"(1994) ""PFSA Modelling of Behavioural Sequences by Evolutionary Programming"" in Stonier, R.J."
459206,"Where does the good stuff go, and why? How contextual semantics influence expression structure in simple genetic programming."
459213,Using a distance metric on genetic programs to understand genetic operators.
459214,The impact of external dependency in genetic programming primitives. In D.B.
459216,Neural programming and an internal reinforcement policy.
463825,"On the Induction of Intelligible Ensembles,"
466170,Deriving monotonic function envelopes from ob-servations.
467383,Evolving Turing-complete programs for a register machine with self-modifying code.
469504,BCM network develops orientation selectivity and ocular dominance from natural scenes environment.
470511,Supporting combined human and machine planning: The Prodigy 4.0 User Interface Version 2.0 (Tech.
481073,PAC adaptive control of linear systems.
486840,Adaptation in constant utility nonstationary environments.
502574,Automatic student modeling and bug library construction using theory refinement.
503871,Growing neural networks.
503877,Evolutionary programming and evolution strategies: Similarities and differences.
503883,(1995) Genetic algorithms with multi-parent recombination.
503893,An evolutionary approach to com-binatorial optimization problems.
509233,A simpler look at consistency.
509315,A computational view of population genetics.
509379,Linden (1998). Model selection using measure functions.
510715,Estimating dependency structure as a hidden variable.
510718,Learning Bayesian networks from incomplete data.
513189,Extended selection mechanisms in genetic algorithms.
519318,Poole (1997). A constraint-based approach to preference elicitation and decision making.
519353,Halpern (1997). Defining explanation in probabilistic systems.
520471,"The Arguments of Newly Invented Predicates in ILP,"
521183,Formalising the knowledge content of case memory systems.
521207,A case base similarity framework.
521251,A yardstick for the evaluation of case-based classifiers.
521252,PAC analyses of a `similarity learning\' IBL al-gorithm.
521269,"Bridge, D.G.: Similarity Metrics: A Formal Unification of Cardinal & Non-Cardinal Similarity Measures,"
521855,Decision-theoretic foundations for causal reasoning.
522338,"Explaining ""explaining away""."
523010,The end of the line for a brain-damaged model of unilateral neglect.
523394,(1996c) Feedback Models: Interpretation and Discovery.
523574,A qualitative framework for probabilistic inference.
529165,"``Gas Identification System using Graded Temperature Sensor and Neural Net Interpretation\'\',"
531348,"Learning belief networks from data: an information theory based approach, forth coming. i Dataset1 has the underlying belief network described in the web page of Norsys Software Corp. Dataset2 has the underlying belief network used by David Heckerman. Dataset3 is generated by Gregory F. Cooper and Edward Herskovits. We generated dataset1 and dataset2 using a Monte Carlo technique. ii The CI tests are grouped by the cardinalities of conditionsets."
531351,"An algorithm for Bayesian belief network construction from data,"
545647,"Learning with Small Disjuncts,"
552469,"On learning more concepts,"
559804,On the testability of causal models with latent and instrumental variables.
560936,"Montel carlo comparison of non-hierarchical unsupervised classifiers,"
561238,S.F. Commonality and Genetic Algorithms.
561364,Markov Chain Monte Carlo Model Determination for Hierarchical and Graphical Models.
561568,Analysis of hospital quality monitors using hierarchical time series models.
561581,"""Priors and Component Structures in Autoregressive Time Series,"""
561582,"""Bayesian Inference on Periodic-ities and Component Spectral Structure in Time Series,"""
561593,"""Filtering via Simulation: Auxiliary Particle Filters"","
561595,"Exploratory Modelling of Multiple Non-stationary Time Series: Latent Process Structure & Decompositions,"" in Modelling Longitudinal and Spatially Correlated Data,"
561610,"(1997a) Bayesian time series: Models and computations for the analysis of time series in the physical sciences. In Maximum Entropy and Bayesian Methods 15,"
561611,"(1997b) Modelling and robustness issues in Bayesian time series analysis (with discussion). In Bayesian Robustness 2,"
561613,"(1997) Studies of quality monitor time series: The V.A. hospital system,"
561674,"(1997) ""Hierarchical mixture models in neurological transmission analysis,"""
561789,"(1996) ""Bayesian analysis of mixtures of mixtures,"""
561809,"(1996) ""Bayesian curve fitting using multivariate normal mixtures,"""
562067,"(1992) Computing Bayesian nonparametric hierarchical models. ISDS Discussion Paper #92-A20,"
562123,Comparison of Bayesian and neural net unsupervised classification techniques.
562940,What online Machine Learning can do for Knowledge Acquisition.
563613,Searls. Gene structure prediction by linguistic methods.
566488,Representing physical and design knowledge in innovative engineering design.
566653,Structural evaluation of analogies:
566664,Making SME greedy and pragmatic.
567005,"An unsupervised neural network for real-time, low-level control of a mobile robot: noise resistance, stability, and hardware implementation."
567018,Representing rhythmic patterns in a network of oscillators.
568045,"(1994) An application of ILP in music,"
568857,Artificial evolution of visual control systems for robots.
573535,"Fast and Simple Algorithms for Perfect Phylogeny and Triangulating Colored Graphs,"
573553,On the Approximability of Numerical Taxonomy.
573964,(1991) Global optimization by means of distributed evolution Genetic Algorithms in Engineering and Computer Science Editor J.
573978,Evolutionary algorithms: Some very old strategies for optimization and adaptation.
574009,Genetic programming for pedestrians.
574264,"An evolutionary tabu search algorithm and the NHL scheduling problem,"
574462,Genetic algorithm programming environments.
574710,Learning decision strategies with genetic algorithms.
575077,Generality and difficulty in genetic programming: Evolving a sort.
575292,Representation and evolution of neural networks.
575331,Genetic algorithms for vertex splitting in DAGs.
575402,"When will a genetic algorithm outperform hill climbing? In Stephanie Forrest, editor,"
575795,Adapting the evaluation space to improve global learning.
576257,Genetic programming of minimal neural nets using occam\'s razor.
576362,"Challenges in evolving controllers for physical robots. Robot and Autonomous Systems,"
576691,Self-Adaption in Genetic Algorithms.
576725,"How good are genetic algortihms at finding large cliques: an experimental study,"
576795,Embedding of a sequential procedure within an evolutionary algorithm for coloring problems in graphs.
576973,Control of Parallel Population Dynamics by Social-Like Behavior of GA-Individuals.
577086,"Evolutionary Search and the Job Shop,"
577227,Convergence analysis of canonical genetic algorithms.
577331,Eiben and C.A. Schippers. Multi-parent\'s niche: n-ary crossovers on NK-landscapes.
578306,A family of txed-point algorithms for independent component analysis.
578309,Simple neuron models for independent component analysis.
578337,"Signal separation by nonlinear Hebbian learning,"
578347,Independent component analysis by general nonlinear hebbian-like learning rules.
578365,"One-unit learning rules for independent component analysis,"
578645,Entailment for specification refinement.
578646,Type inheritance in strongly typed genetic programming.
578649,Augmenting collective adaptation with a simple process agent.
578650,Collective memory search.
578669,Hybridized crossover-based search techniques for program discovery.
578780,Towards automatic discovery of building blocks in genetic programming.
578845,Induction and recapitulation of deep musical structure.
578898,Clique detection via genetic programming.
579008,Genetic programming and redundancy.
579108,Collective Adaptation: The Sharing of Building Blocks.
582139,Viewpoint invariant face recognition using independent component analysis and attractor networks.
582343,Transferring and retraining learned information filters.
582349,Maximum a posteriori classification of DNA structure from sequence information.
582511,The problem with noise and small disjuncts.
583318,Local selection.
589923,"A case study in dynamic belief networks: monitoring walking, fall prediction and detection."
590022,Fall diagnosis using dynamic belief networks.
591016,First order regression: Application in real-world domains.
591017,Producing More Comprehensible Models While Retaining Their Performance.
592826,"`Machine learning in prognosis of the femoral neck fracture recovery\',"
592830,"`Non-myopic attribute estimation in regression\',"
592973,Dynamic training subset selection for supervised learning in genetic programming.
592975,Tackling the boolean even n parity problem with genetic programming and limited-error fitness.
592986,Small populations over many generations can beat large populations over few generations in genetic programming.
592993,Context preserving crossover in genetic programming.
592996,AN ANALYSIS OF HIERARCHICAL GENETIC PROGRAMMING.
593022,"A distributed, component-based ge-netic programming system in C++. Research Note RN/96/2,"
593060,Massively parallel genetic programming.
593068,Rapidly reconfigurable field-programmable gate arrays for accelerating fitness evaluation in genetic programming.
593091,A summary of research on parallel genetic algorithms.
593104,Fitness causes bloat: Mutation.
593105,A bibliography for genetic programming.
593155,Cellular encoding for interactive evolutionary robotics.
593201,Evolving optimal neural networks using genetic algorithms with Occam\'s razor.
593209,Some steps towards a form of parallel distributed genetic programming.
593210,"Discovery of symbolic, neuro-symbolic and neural networks with parallel distributed genetic programming."
593240,Genetic programming with user-driven selection: Experiments on the evolution of algorithms for image enhancement.
593248,Speeding up genetic programming: A parallel BSP implementation.
593260,Evolving graphs and networks with edge encoding: Preliminary report.
593328,"""Evolution of a time-optimal fly-to controller circuit using genetic programming,"""
593329,"""Use of architecture-altering operations to dynamically adapt a three-way analog source identification circuit to accommodate a new source,"""
593544,Toward simulated evolution of machine-language iteration.
593559,"The GP-Music System: Interactive Genetic Programming for Music Composition,"
593560,"B.E., ""Automated Fitness Raters for the GP-Music System,"""
593813,Scheduling maintenance of electrical power transmission networks using genetic programming.
593859,Price\'s theorem and the MAX problem.
593921,Fitness causes bloat in variable size representations.
593942,Why ants are hard.
594011,The evolution of size in variable length representations.
594025,Evolving a generalised behavior: Artificial ant problem revisited.
594039,Hierarchical Learning with Procedural Abstraction Mechanisms.
594047,A Hybrid GP/GA Approach for Co-evolving Controllers and Robot Bodies to Achieve Fitness-Specified Tasks.
594119,"A Genetic Programming Approach to Strategy Optimization in the Extended Two-Dimensional Pursuer/Evader Problem,"
594387,Evolving compact solutions in genetic programming: A case study.
594483,"Jamshidi ""On Genetic Programming of Fuzzy Rule-Based Systems for Intelligent Control."""
594511,"Performance enhanced genetic programming,"
594543,"A methodology for processing problem constraints in genetic programming. Computers and Mathematics with Application,"
594649,Effects of Occam\'s razor in evolving sigma-pi neural networks.
594900,Genetic programming estimates of kol-mogorov complexity.
595056,Using genetic programming to evolve board evaluation functions.
595063,Improving the performance of evolutionary optimization by dynamically scaling the evolution function.
595157,Investigating the generality of automatically defined functions.
595193,Cultural transmission of information in genetic programming.
596075,An architecture for goal-driven explanation.
601462,Evolving globally synchronized cellular automata.
601561,Applying machine learning to agricultural data.
601567,Geometric comparison of classifications and rule sets.
604073,Pruning with generalization based weight saliencies:
606479,The evolution of communication schemes over continuous channaels.
606647,"What makes a good co-evolutionary learning environment? Australian Journal of Intelligent Information Processing Systems,"
608190,Evolving non-determinism: An inventive and efficient tool for optimization and discovery of strategies.
608191,Incremental coevolution of organisms: A new approach for optimization and discovery of strategies.
608292,De Jong and John J.
608326,A sampling-based heuristic for tree search.
610529,"""Visual information processing in primate cone pathways: Part I, a model,"""
612306,Confidence Estimation for Speculation Control.
613409,Efficient Nonparametric Estimation of Probability Density Functions.
616336,Efficient instruction scheduling using finite state automata.
617378,"N.Tishby Testing for Non linearity and Gaussianity in sustained portion of musical signals,"
617575,Cortical activity flips among quasi-stationary states.
621555,Selection of Distance Metrics and Feature Subsets for k-Nearest Neighbor Classifiers.
626530,Belief maintenance with probabilistic logic.
626531,Forecasting glucose concentration in diabetic patients using ignorant belief networks.
626574,Belief maintenance in bayesian networks.
626999,"""Tempering backpropagation networks: Not all weights are created equal"","
627024,Early stopping | but when? In Orr and Muller [1].
628458,"""Optimising Local Hebbian Learning: Use the ffi-rule""."
628459,"CNN: a neural architecture that learns multiple transformations of spatial representations"","
628500,"""Learning to avoid collisions: a reinforcement learning paradigm for mobile robot navigation"","
628667,Generalizing in TD() learning.
628668,On-line adaptive critic for changing systems.
628751,"""Nested networks for robot control,"" in Neural Network Applications,"
628764,Approximation with neural networks: Between local and global approximation.
628766,Orthogonal incremental learning of a feedforward network.
628815,Optimal attitude control of satellites by artificial neural networks: a pilot study.
628888,"""Using many-particle decomposition to get a parallel self-organising map,"""
630817,"Inferring sparse, overcomplete image codes using an efficient coding framework."
630890,A neural model of the cortical representation of egocentric distance.
631015,Theory of correlations in stochastic neural networks.
631052,Objective functions for neural map formation.
632796,Density estimation by wavelet thresholding.
632874,"Minimax Bayes, asymptotic minimax and sparse wavelet priors. In Statistical Decision Theory and Related Topics, V,"
632935,Wavelet methods for curve estimation.
633030,Understanding waveshrink: Variance and bias estimation.
633031,Waveshrink with semi-soft shrinkage functions.
633081,M (1992a). Minimax risk over ` p -balls for l q loss.
633585,Choice of thresholds for wavelet estimation of the log spectrum.
633721,The stationary wavelet transform and some statistical applications.
634902,A heuristic for improved genetic bin packing.
634904,A parallel island model genetic algorithm for the multiprocessor scheduling problem.
634938,A genetic algorithm for fragment allocation in a distributed database system.
634975,Reducing disruption of superior building blocks in genetic algorithms.
636098,NP-Completeness of Searches for Smallest Possible Feature Sets.
636500,Predicting time series with support vector machines.
636511,"""Comparing Support Vector Machines with Gaussian kernels to radial basis function classifiers,"""
640617,"""Staged hybrid genetic search for seismic data imaging,"""
641956,Adaptive noise injection for input relevance determination.
641976,A comparison of some error estimates for neural network models.
642593,Global self organization of all known protein sequences reveals inherent biological signatures.
642621,Looking at Markov samplers through CUM-SUM path plots: a simple diagnostic idea.
642641,(1993) Bayesian inference for agricultural field experiments.
642681,Diagnosing convergence of Markov chain Monte Carlo algorithms.
642798,Weak convergence and optimal scaling of random walk metropolis algorithms.
642827,Decomposable Graphical Gaussian Model Determination.
642847,G.O. (1997) A Total Variation Method for Diagnosing Convergence of MCMC Algorithms.
642894,Rates of convergence of the Hastings and Metropolis algorithms.
642920,A connectionist architecture with inherent systematicity.
642930,A connectionist architecture for learning to parse.
643003,"Estimating Ratios of Normalizing Constants for Densities with Different Dimensions,"
643069,Markov chain Monte Carlo in practice: A roundtable discussion.
643199,Mutation rates as adaptations.
643221,Minorization conditions and convergence rates for Markov chain Monte Carlo.
643239,Convergence of Gibbs sampler for a model related to James-Stein estimators.
643485,"""Geometric Ergodicity of the Block Gibbs Sampler for a Simple Hierarchical Model."""
643597,(1997) A nonparametric Bayesian approach to modelling nonlinear time series.
643695,(1997) Simulation based Bayesian nonparametric regression methods.
643734,"Engineering Multiversion Neural-Net Systems,"
643735,"""Use of methodological diversity to improve neural network generalization,"""
643777,"""Self-organizing experts,"""
644093,Possible biases induced by MCMC convergence diagnostics.
644334,"D.M. (1998) Convergence controls for MCMC algorithms, with applications to hidden Markov chains."
644361,Perfect simulation of Harris recurrent Markov chains.
644363,Exact simulation using Markov chains.
644427,Outperforming the Gibbs sampler empirical estimator for nearest neighbour random fields.
644441,(1997) MCMC Convergence Diagnostic via the Central Limit Theorem.
644448,"G.O. and Sahu, S.K. (1997) Adaptive Markov chain Monte Carlo through regeneration."
644470,An Adaptive Metropolis algorithm.
644494,Self regenerative Markov chain Monte Carlo.
644577,Geometric ergodicity and hybrid Markov chains.
644843,"(1997) Perfect Simulation of some Point Processes for the Impatient User, Advances in Applied Probability, Stochastic Geometry and Statistical Applications,"
645016,Extensions of Fill\'s algorithm for perfect simulation.
645046,Exponential convergence of Langevin diffusions and their discrete approximations.
645084,"Modelling risk from a disease in time and space,"
645088,Hierarchical spatio-temporal mapping of disease rates.
645452,An extension of Fill\'s exact sampling algorithm to non-monotone chains.
645571,A note on the Dirichlet process prior in Bayesian nonparametric inference with partial exchangeability.
645870,Exact transition probabilities for the independence Metropolis sampler.
645897,On convergence rates of Gibbs samplers for uniform distributions.
646195,"(1997b) Applications and extensions of MCMC in IRT: Multiple item types, missing data, and rated responses."
646286,(1996) Rate of Convergence of the Gibbs Sampler by Gaussian Approximation.
646289,(1997) Bayesian Estimation and Model Choice in the Item Response Models.
646334,Self-targeting candidates for Hastings-Metropolis algorithms.
646357,Geometric and subgeometric convergence of diffusions with given stationary distributions.
646412,(1998) A new sequential simulated annealing method.
646440,A reversible jump sampler for autoregressive time series.
646809,Orgy in the computer: Multi-parent reproduction in genetic algorithms.
646836,Raising GA performance by simultaneous tuning of selective pressure and recombination disruptiveness.
646837,Back. An evolutionary heuristic for the minimum vertex cover prob-lem.
646900,Evaluating and improving steady state evolutionary algorithms on constraint satisfaction problems.
646913,Graph coloring with adaptive evolutionary algorithms.
647315,Adapting crossover in evolutionary algorithms.
647408,Every niching mehtod has its niche: Fitness sharing and implicit sharing compared.
647413,Solving 3-SAT by GAs adapting constraint weights.
647447,Performance of multi-parent crossover operators on numerical function optimization problems.
648106,"(1995) Brightness perception, illusory contours, and corticogeniculate feedback."
648112,3-D vision and figure-ground separation by visual cortex.
648121,Synthetic aperture radar processing by a multiple scale neural system for boundary and surface representation.
648232,"Vector associative maps: Unsupervised real-time error-based learning and control of movement trajectories,"
648369,Toward a unified theory of spatiotemporal processing in the retina.
649730,A growth algorithm for hypercubical output spaces in self-organizing feature maps.
649731,Incremental grid growing: encoding high-dimensional structure into a two-dimensional feature map.
