ID,Title
22563,"""A Comparative Study of ID3 and Backpropagation for English Text-to-Speech Mapping,"""
22564,Pronouncing Names by a Combination of Rule-Based and Case-Based Reasoning.
22566,"""A Comparison of ANAPRON with Seven Other Name-pronunciation Systems,"""
22835,Vuurpijl and Th.E. Schouten. A Scalable Performance Prediction Model for Parallel Neural Network Simulations.
22869,Applying case-based reasoning to control in robotics.
22874,A similarity-based retrieval tool for software repositories.
22875,Inductive learning and case-based reasoning.
22876,Supporting flexibility. a case-based reasoning approach.
22883,On the informativeness of the DNA promoter sequences domain theory.
22886,Continuous case-based reasoning.
23069,On the logic of iterated belief revision.
23070,"A Knowledge-Based Framework for Belief Change, Part II: Revision and Update."
23116,Bayesian Methods for Adaptive Models.
23258,"""Exploration and model building in mobile robot domains"","
23448,Data exploration using self-organizing maps.
23502,A distributed feature map model of the lexicon.
23507,"""Natural language processing with modular neural networks and distributed lexicon."""
23545,Towards concept formation grounded on perception and action of a mobile robot.
23546,Learning action-oriented perceptual features for robot navigation.
23738,A Theory of Learning Classification Rules.
23774,High-Performance Job-Shop Scheduling With A Time-Delay TD() Network.
24043,Human Face Detection in Visual Scenes.
24476,Representing preferences as ceteris paribus comparatives.
24530,Approximating value trees in structured dynamic programming.
24966,A practical Bayesian framework for backpropagation networks.
24974,Rasmussen (1996). Evaluation of Gaussian Processes and Other Methods for Nonlinear Regression.
25181,Bilinear separation of two sets in n-space.
25184,Street. Feature selection via mathematical programming.
25413,Simultaneous Multithreading: A Platform for Next-Generation Processors.
25702,Nonlinear Prediction of Chaotic Time Series.
25772,Flexible metric nearest neighbor classification.
25791,"Adapting Bias by Gradient Descent: An Incremental Version of Delta-Bar-Delta,"
25794,Is Learning the n-th Thing Any Easier Than Learning the First? in:
25805,"Weakly Learning DNF and Characterizing Statistical Query Learning Using Fourier Analysis,"
26850,Determining mental state from EEG signals using neural networks.
27174,Mathematical programming in neural networks.
27199,Learning unions of boxes with membership and equivalence queries.
27203,"""The Power of Self-Directed Learning"","
27230,Enhancing model-based learning for its application in robot navigation.
27241,Error Reduction through Learning Multiple Descriptions.
27243,"An Empirical Comparison of Voting Classification Algorithms: Bagging, Boosting, and Variants."
27246,"Working Notes of AAAI Workshop on Integrating Multiple Learned Models for Improving and Scaling Machine Learning Algorithms (available at http://www.cs.fit.edu/~imlm/papers.html), Portland,"
27249,"Machine Learning Bias, Statistical Bias, and Statistical Variance of Decision Tree Algorithms."
27250,Why does Bagging Work? a Bayesian Account and its Implications.
27510,Measuring the difficulty of specific learning problems.
27514,Statistical biases in backpropagation learning.
27530,Learning symbolic rules using artificial neural networks.
27531,Using sampling and queries to extract rules from trained neural networks.
27535,Combining neural and symbolic learning to revise probabilistic rule bases.
27543,"""Extracting rules from artificial neural networks with distributed representations"","
27606,Statistical queries and faulty PAC oracles.
27612,On the sample complexity of weak learning.
27623,Neural network exploration using optimal experiment design.
27627,"Information-Based Objective Functions for Active Data Selection,"
27631,"""Robot Juggling: An Implementation of Memory-Based Learning,"""
27632,Reinforcement driven information acquisition in nondeterministic environments.
27895,Instance-based learning algorithms.
28026,"`Case Retrieval Nets applied to large case bases\',"
28202,Baird (1995). Residual algorithms: Reinforcement learning with function approximation.
28227,Reinforcement learning methods for continuous time markov decision problems.
28230,Decision-theoretic case-based reasoning.
28249,Truncating temporal differences: On the efficient implementation of TD() for reinforcement learning.
28254,"""Active Learning with Statistical Models,"""
28265,Using Introspective Reasoning to Select Learning Strategies.
28267,Choosing learning strategies to achieve learning goals.
28278,Reinforcement learning for planning and control.
28287,Robot shaping: Developing autonomous agents though learning.
28290,Genetic-based machine learning and behavior based robotics: a new syntesis.
28336,Evolving behavioral strategies in predators and prey.
28350,On the convergence of stochastic iterative dynamic programming algorithms.
28359,Associative reinforcement learning: A generate and test algorithm.
28385,A distributed reinforcement learning scheme for network routing.
28387,Pack Kaelbling. On the complexity of solving Markov decision problems.
28389,Creating advice-taking reinforcement learners.
28412,Memory-based learning for control.
28447,"""Multistrategy Learning in Reactive Control Systems for Autonomous Robotic Navigation,"""
28456,A competitive approach to game learning.
28471,Markov decision pro cesses in large state spaces.
28473,Adaptive load balancing: A study in multi-agent learning.
28485,"The efficient learning of multiple task sequences,"
28487,Learning to Solve Markovian Decision Processes.
28489,"Learning without state-estimation in Partially Observable Markovian Decision Processes,"
28491,Reinforcement learning with replacing eligibility traces.
28504,TD models: modeling the world at a mixture of time scales.
28542,Analysis of some incremental variants of policy iteration: First steps toward understanding actor-critic learning systems.
28632,Universal portfolios with and without transaction costs.
28640,Predicting a binary sequence almost as well as the optimal biased coin.
28641,"Game theory, on-line prediction and boosting."
28649,On-line learning of linear functions.
28674,"A theory of unsupervised speedup learning,"
28851,"Oppacher (1994). Program search with a hierarchical variable length representation: genetic programming, simulated annealing and hill climbing,"
28957,Operations for learning with graphical models.
28964,Robust learning with missing data.
29492,Induction of multiscale temporal structure.
29708,Diffusion of credit in markovian models.
29723,Boltzmann chains and hidden Markov models.
29738,"""An Optimum Decision Rule for Pattern Recognition,"""
30817,"""Analysis of Linsker\'s simulations of Hebbian rules,"""
30895,Committees of decision trees.
30901,"Lookahead and Pathology in Decision Tree Induction,"
30934,"Selective Sampling Using the Query by Committee Algorithm,"
30973,Plate. Holographic Reduced Representations.
31043,"FONN: Combining first order logic with connectionist learning,"
31055,Extracting Comprehensible Models from Trained Neural Networks.
31083,Data Minining using MLC++: A Machine Learning Library in C++.
31097,What DaimlerBenz has learned as an industrial partner from the machine learning project Statlog. Working Notes for Applying Machine Learning in Practice:
31105,Learning from bad data.
31336,The megaprior heuristic for discovering protein sequence patterns.
31349,Motif-based hidden Markov models of protein families.
31353,Hidden Markov models in computational biology: Applications to protein modeling.
31479,Induction of Recursive Bayesian Classifiers In Proc.
31483,"""Induction of selective bayesian classifiers,"""
31489,I.M.: Adapting to unknown smoothness via wavelet shrinkage.
31769,"Learning Visual Schemas in Neural Networks for Object Recognition and Scene Analysis,"
31863,Unsupervised Learning using MML.
31927,A generalized hidden Markov model for the recognition of human genes in DNA.
31932,A decision tree system for finding genes in dna.
32083,Back propagation is sensitive to initial conditions.
32260,On-line portfolio selection using multiplicative updates.
32276,Extracting support data for a given task.
32688,(1994) Classification using Hierarchical Mixtures of Experts.
32698,Ensemble learning for hidden Markovmodels.
32872,Acting under uncertainty: Discrete bayesian models for mobile-robot navigation.
33013,Learning conventions in multiagent stochastic domains using likelihood estimates.
33231,Probabilistic independence networks for hidden Markov probability models.
33301,The Design and Implementation of a Case based Planning Framework within a Partial Order Planner.
33303,Design and Implementation of a Replay Framework based on a Partial order Planner.
33325,"Applying Winnow to Context Sensitive Spelling Correction,"
33412,Learning to predict reading frames in E. coli DNA sequences.
33818,"Statistical mechanics of nonlinear nonequilibrium financial markets: Applications to optimized trading,"
33823,"Statistical mechanics of neocortical interactions. EEG dispersion relations,"
33895,"A promising genetic algorithm approach to job-shop scheduling, rescheduling, and open-shop scheduling problems."
33904,Stochastic hillclimbing as a baseline method for evaluating genetic algorithms.
33907,A genetic algorithm for the set partitioning problem.
34082,Reference classes and multiple inheritances.
34257,A self-adjusting dynamic logic module.
34263,An Efficient Transformation for Implementing Two-Layer FeedForward Neural Networks.
34266,"A VLSI Implementation of a Parallel, Self-Organizing Learning Model,"
34315,(1997) Gaussian pro cesses for Bayesian classification via hybrid Monte Carlo.
34355,N.T. (1995) Prior Knowledge and the Creation of Virtual Examples for RBF Networks.
34708,Learning to represent codons: A challenge problem for constructive induction.
34961,Comparing methods for refining certainty-factor rule-bases.
34979,and P.M. Long. Apple tasting and nearly one-sided learning.
35061,Evolving networks: Using the genetic algorithm with connectionist learning.
35070,The RISE system: Conquering without separating.
35335,Parallel gradient distribution in unconstrained optimization.
35343,"""Serial and Parallel Backpropagation 18 References Convergence Via Nonmonotone Perturbed Minimization,"""
35490,A Model-Based Approach to Blame Assignment in Design.
35778,Context-specific independence in Bayesian networks.
35797,Proben1: A set of neural network benchmark problems and benchmarking rules.
35852,Generalization and scaling in reinforcement learning.
35854,"and P.M. Long. Characterizations of learnability for classes of f0; :::; ng-valued functions. To appear,"
35863,Learning functions in k-DNF from reinforcement.
35905,"Equivalence and reduction of hidden Markov models,"
35922,Mean field theory for sigmoid belief networks.
36131,Kanazawa Adaptive probabilistic networks.
36140,Error-correcting output codes: A general method for improving multiclass inductive learning programs.
36145,Generating accurate and diverse members of a neural-network ensemble.
36162,"Bumptrees for Efficient Function, Constraint, and Classification Learning,"
36167,Exploiting Model Uncertainty Estimates for Safe Dynamic Control Learning.
36620,Towards a better understanding of memory-based and bayesian classifiers.
36802,The data association problem when monitoring robot vehicles using dynamic belief networks.
37483,Learning approximate control rules of high utility.
37541,Parity: the problem that won\'t go away.
37879,"(1997) Variational methods for inference and estimation in graphical models. Unpublished doctoral dissertation,"
37884,Hidden Markov decision trees.
37888,Stochastic simulation algorithms for dynamic probabilistic networks.
37998,"Combining Top-down and Bottom-up Techniques in Inductive Logic Programming,"
38000,Inducing logic programs without explicit negative examples.
38205,Competitive environments evolve better solutions for complex tasks.
38480,Learning to achieve goals.
38537,"Bayesian Statistics 4,"
38722,Learning probabilistic automata with variable memory length.
38771,"Improving the quality of automatic DNA sequence assembly using fluorescent tracedata classifications. In States, D.J.,"
38829,From Design Experiences to Generic Mechanisms: Model-Based Learning in Analogical Design.
38839,"A Model of Creative Understanding,"
38845,Opportunistic Reasoning: A Design Perspective.
38846,"Explaining Serendipitous Recognition in Design,"
39124,The utility of feature weighting in nearest-neighbor algorithms.
39126,Toward optimal feature selection.
39127,Estimating attributes: Analysis and extension of relief.
39130,Average-case analysis of a nearest neighbour algorithm.
39131,Oblivious decision trees and abstract cases.
39165,Efficient learning of selective Bayesian network classifiers.
39199,Unsupervised learning by convex and conic coding.
39210,Pattern analysis and synthesis in attractor neural networks.
39403,Auto-exploratory av-erage reward reinforcement learning.
39474,"Simulated annealing for hard satisfiability problems. In, Workshop Notes from the 1993 DIMACS Challenge. FINDING HARD INSTANCES OF THE SATISFIABILITY PROBLEM 17"
39890,A theory of inferred causation.
39904,Performance Prediction of Large MIMD Systems for Parallel Neural Network Simulations.
40124,MacKay (1995). Probabilistic networks: new models and new methods.
40125,Neal (1997). Monte Carlo Implementation of Gaussian Process Models for Bayesian Regression and Classification.
40131,Comparison of neural net and conventional techniques for lighting control.
40135,"""Refining PID controllers using neural networks,"""
40151,"Hoeffding Races: Accelerating Model Selection Search for Classification and Function Approximation,"
40583,Wavelet Tresholding via a Bayesian Approach.
40605,Nonlinear wavelet shrinkage with Bayes rules and Bayes factors.
40886,Generalisation performance of backpropagation learning on a syllabification task.
40922,An optimal weighting criterion of case indexing for both numeric and symbolic attributes.
41216,"""A simple algorithm that discovers efficient perceptual codes,"" in Computational and Psychophysical Mechanisms of Visual Coding,"
41417,"Case-based Acquisition of User Preferences for Solution Improvement in Ill-Structured Domains,"
41666,Separating formal bounds from practical performance in learning systems.
41714,"Cliff (1993). ""Issues in evolutionary robotics,"" From Animals to Animats 2 (Ed."
41732,Emergent control and planning in an autonomous vehicle.
42156,"""Models of Parallel Adaptive Logic,"""
42207,Asking questions to minimize errors.
42209,"""Learning unions of two rectangles in the plane with equivalence queries"","
42221,Composite geometric concepts and polynomial predictability.
42847,Power system security margin prediction using radial basis function networks.
42848,Evolving Fuzzy Prototypes for Efficient Data Clustering.
43165,Natural language grammatical inference: A comparison of recurrent neural networks and machine learning methods.
43186,"""Learning Feature-based Semantics with Simple Recurrent Networks,"""
43639,"Field, ""Natural image statistics and efficient coding"","
43698,Dirichlet mixtures: A method for improving detection of weak but significant protein sequence homology. COS.
44017,Learning decision lists using homogeneous rules.
44121,"""Factor graphs and algorithms,"""
44368,"""Using Problem Generators to Explore the Effects of Epistasis,"""
44455,Har-vey (1993) Evolving Visually Guided Robots.
44514,The observer\'s paradox: Apparent computational complexity in physical systems.
45052,Bayesian model averaging.
45061,Bias and the quantification of stability.
45188,"A bound on the error of Cross Validation using the approxima-tion and estimation rates, with consequences for the training-test split."
45189,An experimental and theoretical comparison of model selection methods.
45212,Gain adaptation beats least squares.
45533,Priority ASOCS.
45599,Grounding robotic control with genetic neural net-works.
45603,Symbiotic Evolution of Neural Networks in Sequential Decision Tasks.
45605,"""Learning and evolution in neural networks,"""
46079,A sequential niche technique for multimodal function optimization.
46431,"Growing Simpler Decision Trees to Facilitate Knowledge Discovery,"
46452,Incremental reduced error pruning.
46468,A statistical approach to decision tree modeling.
46470,On the Boosting Ability of Top-Down Decision Tree Learning Algorithms.
46476,"A counter example to the stronger version of the binary tree hypothesis,"
46491,constructive induction of M-of-N concepts for discriminators in decision trees.
46500,Learning complex boolean functions : Algorithms and applications.
46501,Decision graphs an extension of decision trees.
46536,Goal-directed Classification Using Linear Machine Decision Trees.
46547,Constructing conjunctive tests for decision trees.
46887,(1991) Learning Polynomial functions by feature Construction.
47570,Justification structures for document reuse.
47682,Martinez (1993). Using Precepts to Augment Training Set Learning.
47683,An Incremental Learning Model for Commonsense Reasoning.
47684,An Efficient Metric for Heterogeneous Inductive Learning Applications in the Attribute-Value Language.
47839,Algorithms for partially observable markov decision processes.
48066,(1998) Pruning decision trees with misclassification costs.
48075,"(1997) Adaptive fraud detection. Data Mining and Knowledge Discovery,"
48550,Identification and control of nonlinear systems using neural network models: Design and stability analysis.
48555,Feedback stabilization using two-hidden-layer nets.
48764,Incremental evolution of complex general behavior.
48766,Discovering complex Othello strategies through evolutionary neural networks.
48768,(in press). Evolving Neural Networks to Play Go.
48781,Optimal and asymptotically optimal equi-partition of rectangular domains via stripe decomposition.
49482,Topography and ocular dominance: A model exploring positive correla-tions.
49660,Feature subset selection as search with probabilistic estimates.
49720,Bayesian Experimental Design: A Review.
49753,Bayesian Design of Experiments for the Linear Model.
49811,Estimating the accuracy of learned concepts.
49843,"Fossil: A robust relational learner""."
49844,A comparison of pruning methods for relational concept learning.
49847,Top-down pruning in relational learn-ing.
49895,The origins of Inductive Logic Programming: A prehistoric tale.
50336,Computing upper and lower bounds on likelihoods in intractable networks.
50337,Jordan (1996b). Recursive algorithms for approximating proba-bilities in graphical models.
50354,Backpropagation can give rise to spurious local minima even for networks without hidden layers.
50381,Training algorithms for hidden Markov models using entropy based distance functions.
50807,Unsupervised learning with the soft-means algorithm.
50838,"""Clustering learning tasks and the selective cross-task transfer of knowledge"","
50980,(1996) Parametric design problem solving.
51045,"Experiments with a regression-based causal induction algorithm. EKSL memo number 94-33,"
51049,"Causal inference, path analysis, and recursive structural equations models."
51052,A statistical semantics for causation.
51180,On the learnability and usage of acyclic probabilistic finite automata.
51831,"Using Prior Knowledge in a NNDPA to Learn Context-Free Languages,"
51834,Representing and restructuring domain theories: A constructive induction approach.
51866,Bias-driven revision of logical domain theories.
51879,"""Combining Connectionist and Symbolic Learning to Refine Certainty Factor Rule Bases,"""
51909,Automated refinement of first-order horn-clause domain theories.
51934,"optimize, analyze, repeat (SOAR): Application of neural network tools to ECG patient monitoring."
52000,"RADIAL BASIS FUNCTIONS: L p -Approximation orders with scattered centres, Preprint. APPROXIMATION FROM PERTURBED SHIFTS 35"
52003,"Approximation by scattered shifts of a radial basis function,"
52007,"An upper bound on the approximation power of principal shift-invariant spaces,"
52515,Unsupevised learning of distributions on binary vectors using two-layer networks.
52784,An empirical evaluation of bagging and boosting.
52835,On biases estimating multi-valued attributes.
52847,Rule-based machine learning methods for function prediction.
53942,Simplifying decision trees: A survey.
54129,Strongly Typed Genetic Programming.
54131,"An Analysis of Genetic Programming,"
54132,Causality in genetic programming.
54550,Analysis and empirical studies of derivational analogy.
54844,A Model of Bias Learning.
55403,"R.S. and Imam, I.F. On Learning Decision Structures."
55770,The case for cases: a call for purity in case-based reasoning.
55801,Within the letter of the law: planning among multiple cases.
55968,"""Reinforcement learning in the multi-robot domain"","
56112,"Grefenstette (1990). ""Simulation-assisted learning by competition: Effects of noise differences between training model and target environment,"""
56115,Improving tactical plans with genetic algorithms.
56119,Using a genetic algorithm to learn strategies for collision avoidance and local navigation.
56167,Refining conversational case libraries.
56708,Alecsys and the autonomouse: Learning to control a real robot by distributed classifier systems.
56709,"""Genetic and Non-Genetic Operators in Alecsys,"""
57119,Finding opponents worth beating: Methods for competitive co-evolution.
57764,"""Inductive Learning by Selection of Minimal Complexity Representations,"""
57773,Scheduling and mapping: Software pipelining in the presence of structural hazards.
57922,A note on learning from multiple--instance examples.
57932,"A comparison of dynamic reposing and tangent distance for drug activity prediction,"
57948,PAC learning axis-aligned rectangles with respect to product distributions from multiple-instance examples.
58268,"The Expandable Split Window Paradigm for Exploiting Fine-Grain Parallelism,"
58436,Intelligent model selection for hillclimbing search in computer-aided design.
58453,"""Intelligent Gradient-Based Search of Incompletely Defined Design Spaces""."
58454,Ellman. Learning prototype-selection rules for case-based iterative design.
58540,Explanation-based learning and reinforcement learning: A unified approach.
58552,"Hampshire (1992), A Differential Theory of Learning for Statistical Pattern Recognition with Connectionist Models,"
58758,"Job Shop Scheduling with Genetic Algorithms,"
59045,Prediction games and arcing algorithms.
59244,Explaining anomalies as a basis for KB refinement.
59626,General bounds on statistical query learning and PAC learning with noise via hypothesis boosting.
59715,"""Genetic Programming Exploratory Power and the Discovery of Functions,"""
59772,Serial and parallel multicategory discrimination.
59798,Pattern recognition via linear programming: Theory and application to medical diagnosis.
60159,CuPit | a parallel language for neural algorithms: Language reference and tutorial.
60169,"A parallel programming model for irregular dynamic neural networks. In W.K. Giloi,"
60170,Connection pruning with static and adaptive pruning schedules.
60560,"Globally convergent inexact Newton methods,"
60682,Dynamically adjusting concepts to accommodate changing contexts.
61069,Tracking the red queen: Measurements of adaptive progress in co-evolutionary simulations.
61073,Evolution of Homing Navigation in a Real Mobile Robot.
61312,Evolutionary wanderlust: Sexual selection with directional mate preferences.
61417,An Efficient Subsumbtion Algorith for Inductive Logic Programming.
62274,A comparison of new and old algorithms for a mixture estimation problem.
62329,"Automatic Definition of Modular Neural Networks. Adaptive Behavior,"
62333,"Robust Sound Localization: An Application of an Auditory Perception System for a Humanoid Robot,"
62347,Embodiment and manipulation learning process for a humanoid hand.
62389,"""New roles for machine learning in design,"""
62417,Free energy coding.
62607,Generalization of Clauses under Implication.
62634,"""A Study in Program Response and the Negative Effects of Introns in Genetic Programming,"""
62676,Nonsmooth dynamic simulation with linear programming based methods.
62718,An enhancer for reactive plans.
63477,Efficient feature selection in conceptual clustering.
63486,"""Evaluation and Selection of Biases in Machine Learning,"""
63549,A practical Monte Carlo implementation of Bayesian learning.
63812,FLARE: Induction with Prior Knowledge.
63832,"Schultz (1994). ""An evolutionary approach to learning in robots,"" Machine Learning Workshop on Robot Learning,"
63835,A heuristic approach to the discovery of macro-operators.
63915,Learning the past tense of english verbs: the symbolic pattern associators vs. connectionist models.
63931,Combining FOIL and EBG to speedup logic programs.
64271,"(1992) Generic Teleological Mechanisms and their Use in Case Adaptation,"
64319,Improved noise-tolerant learning and generalized statistical queries.
64484,Learning from an automated training agent.
64519,"Utilization Filtering: a method for reducing the inherent harmfulness of deductively learned knowledge,"
65057,Abduction as belief revision.
65074,"Rank-based systems: A simple approach to belief revision, belief update, and reasoning about evidence and actions."
65212,Bayesian training of backpropagation networks by the hybrid monte carlo method.
65650,Predicting nearly as well as the best pruning of a decision tree.
65653,Pessimistic Decision Tree Pruning Based on Tree Size.
66556,"""The Schema Theorem and Price\'s Theorem,"""
66563,"An experimental analysis of schema creation, propagation and disruption in genetic programming."
66564,Genetic programming with one-point crossover.
