ID,Title
35,"Genetic Algorithms in Search, Optimization and Machine Learning."
40,Dynamic control of genetic algorithms using fuzzy logic techniques.
114,Learning to Act using Real- Time Dynamic Programming.
117,Dynamic Programming and Markov Processes.
128,Reinforcement Learning Algorithms for Average-Payoff Markovian Decision Processes.
130,Ok. Scaling up average reward reinforcement learning by approx-imating the domain models and the value function.
164,Learning polynomials with queries: The highly noisy case.
288,"Memory-based Stochastic Optimization,"
424,A hybrid nearest-neighbor and nearest-hyperrectangle algorithm.
434,Learning Analytically and Inductively.
463,"""Abstraction and Decomposition in Hill-climbing Design Optimization""."
504,Constructive belief and rational representation.
506,"Rationality and its Roles in Reasoning (extended version),"
887,Some studies in machine learning using the game of Checkers.
906,Regularization thory and neural networks architectures.
910,"A Theory of Networks for Approximation and Learning,"
936,The Use of Explicit Goals for Knowledge to Guide Inference and Learning.
940,Decision Models: A Theory of Volitional Explanation.
941,Incremental Learning of Explanation Patterns and their Indices.
943,"Indexing, Elaboration and Refinement: Incremental Learning of Explanatory Cases."
1026,"Phenes and the Baldwin Effect: Learning and evolution in a simulated population,"
1033,The evolutionary cost of learning.
1034,"No Gain: Landscapes, Learning Costs and Genetic Assimilation, submitted to EC and University of Sussex, CSRP 409(?) [Merezhkovsky, KS, 1920] in Khakina LN (1992) Concepts of Symbiogenesis: History of Symbiogenesis as an evolutionary mechanism,"
1035,Evolving sensors in environments of controlled complexity.
1213,Efficient superscalar performance through boosting.
1237,"Toward Learning Systems That Integrate Different Strategies and Representations. In: Artificial Intelligence and Neural Networks: Steps toward Principled Integration. Honavar,"
1246,The Design and Analysis of Efficient Learning Algorithms.
1272,"""Induction of Decision Trees,"""
1365,"Self-Organization and Associative Memory,"
1385,Learning coordinated behaviors for control of a simulated robot.
1481,"Case-based reasoning: Foundational issues, methodological variations, and system approaches."
1688,"""Using DNA to solve NP-Complete Problems"","
1694,"(1993) A NN Algorithm for Hard Satisfiability problems,"
1717,On convergence properties of the em algorithm for gaussian mixtures.
1786,A benchmark for classifier learning.
1817,Hybrid Learning Using Genetic Algorithms and Decision Trees for Pattern Classification.
1919,The frame problem and Bayesian network action representations.
1949,Linking adaptation and similarity learning.
1951,Adaptive similarity assessment for case-based explanation.
1952,Combining rules and cases to learn case adaptation.
1953,Representing self-knowledge for introspection about memory search.
1955,"Machine Learning: A Multistrategy Approach,"
1956,"Inferential Theory of Learning: Developing Foundations for Multistrategy Learning, in Machine Learning: A Multistrategy Approach, Vol. IV, R.S."
1959,Introspective Reasoning using Meta-Explanations for Multistrat-egy Learning.
1997,Estimating the error rate of a prediction rule: improvement on cross-validation.
1999,Wrappers for Performance Enhancement and Oblivious Decision Graphs.
2354,"A Statistical Approach to Solving the EBL Utility Problem,"
2440,Learning logical definitions from relations.
2653,A Decision-theoretic Generalization of On-line Learning and an Application to Boosting.
2654,Experiments with a New Boosting Algorithm.
2658,A new learning algorithm for blind signal separation.
2663,The Canonical Metric For Vector Quantization.
2665,An Information Maximization Approach to Blind Separation and Blind Deconvolution.
2695,"Combining exploratory projection pursuit and projection pursuit regression with application to neural networks, 1991."
2696,"Objective function formulation of the BCM theory of visual cortical plasticity: Statistical connections, stability conditions."
2698,"Face recognition using a hybrid supervised/unsupervised neural network, 1992."
2702,TK (1994). Fast non-linear dimension reduction.
3084,A comparative utility analysis of case-based reasoning and control-rule learning systems.
3085,A model of similarity-based retrieval.
3095,Constructive similarity assessment: Using stored cases to define new situa tions.
3097,Towards a computer model of memory search strategy learning.
3101,Acquiring case adaptation knowledge: A hybrid approach.
3112,Veloso (1994). Planning and Learning by Analogical Reasoning.
3187,A reference Bayesian test for nested hypotheses and its relationship to the Schwarz criterion.
3191,Model selection and accounting for model uncertainty in graphical models using Occam\'s window.
3192,Bayesian graphical models for discrete data.
3217,"Theory and Applications of Agnostic PAC-Learning with Small Decision Trees,"
3218,Rule induction with CN2: some recent improvements.
3220,A Weighted Nearest Neighbor Algorithm for Learning with Symbolic Features.
3222,Beyond independence: Conditions for the optimality of the simple bayesian classifier.
3223,Supervised and unsupervised discretization of continuous features.
3229,Introduction to the Theory of Neural Computa 92 tion.
3231,Irrelevant features and the subset selection problem.
3232,"The Power of Decision Tables,"
3233,A study of cross-validation and bootstrap for accuracy estimation and model selection.
3235,"Scaling up the accuracy of naive-bayes classifiers: a decision-tree hybrid. In Proceedings of the Second International Conference on Knowledge Discovery and Data Mining,"
3236,A machine learning library in C++.
3237,Feature subset selection using the wrapper method: Overfitting and dynamic search space.
3240,"""An analysis of bayesian classifiers,"""
3243,A system for induction of oblique decision trees.
3828,A theory of questions and question asking.
3932,Finding analogues for innovative design.
4274,"`Multistrategy learning and theory revision\',"
4329,Supervised learning from incomplete data via an EM approach.
4330,"Hierarchical Mixtures of Experts and the EM Algorithm,"
4335,A new view of the EM algorithm that justifies incremental and other variants.
4553,Learning Classification Rules Using Lattices.
4584,Neuronlike adaptive elements that can solve difficult learning control problems.
4637,Learning to model sequences generated by switching distributions.
4649,A knowledge-intensive approach to learning relational concepts.
4660,Context-sensitive learning methods for text categorization.
4804,Toward efficient agnostic learning.
4878,"""Cooperative Case-Based Reasoning"","
4983,A computational environment for exhaust nozzle design.
5038,Using and com-bining predictors that specialize.
5055,W.S. Boosting the Margin: A New Explanation for the Effectiveness of Voting Methods.
5062,A Memory Model for Case Retrieval by Activation Passing.
5064,Case Retrieval Nets: Basic ideas and extensions. accepted for:
5069,Applying Case Retrieval Nets to diagnostic tasks in technical domains. accepted for:
5075,An investigation of marker-passing algorithms for analogue retrieval.
5086,Bayes factors and model uncertainty.
5194,"""For neural networks, function determines form,"""
5348,(1992) Feature extraction using an unsupervised neural network.
5454,"""A self-organizing multiple-view representation of 3-D objects,"""
5462,"Prior, stabilizers and basis functions : from regularization to radial, tensor and additive splines."
5600,Derivation replay for partial-order planning.
5869,Observation on cortical mechanisms for object recognition and learning.
5959,Selection of relevant features in machine learning.
5966,Cost-Sensitive Classification: Empirical Evaluation of a Hybrid Genetic Decision Tree Induction Algorithm.
6125,Boosting a Weak Learning Algorithm by Majority.
6130,Local error bars for nonlinear regression and time series prediction.
6151,Strategy Learning with Multilayer Connectionist Represent ations.
6152,Reinforcement Learning with Modular Neural Networks for Control.
6155,On the Computational Economics of Reinforcement Learning.
6163,Generalization in reinforcement learning: Safely approximating the value function.
6169,Improving elevator performance using reinforcement learning.
6170,SP (1996). Improving policies without measuring merits.
6184,"""Forward Models: Supervised Learning with a Distal Teacher,"""
6196,"""The Parti-game Algorithm for Variable Resolution Reinforcement Learning in Multidimensional State Spaces,"""
6209,"Transfer of Learning by Composing Solutions of Elemental Sequential Tasks,"
6210,Reinforcement Learning with Soft State Aggregation.
6213,Learning to predict by the methods of temporal differences.
6214,"Integrated Architectures for Learning, Planning and Reacting Based on Approximating Dynamic Programming,"
6215,"""Planning by Incremental Dynamic Programming."""
6216,Generalization in reinforcement learning: Successful examples using sparse coarse coding.
6217,"R.S., & Whitehead, S.D. (1993). Online learning with random representations."
6220,Issues in using function approximation for reinforcement learning.
6224,Tight Performance Bounds on Greedy Poli cies Based on Imperfect Value Functions.
6238,Autonomous Learning from the Environment.
6311,Addressing the Selective Superiority Problem: Automatic Algorithm/Model Class Selection.
6318,Rule induction and instance-based learning: A unified approach.
6334,Prototype and feature selection by sampling and random mutation hill climbing algorithms.
6343,"A Review and Comparative Evaluation of Feature Weighting Methods for Lazy Learning Algorithms,"
6344,"Heterogeneous Radial Basis Functions,"
6346,"Instance-Based Learning with Genetically Derived Attribute Weights,"
6378,Learning to coordinate without sharing information.
6385,Multi-agent reinforcement learning: independent vs.
6539,Quantifying prior determination knowledge using PAC learning model.
6639,Stochastic Inductive Logic Programming.
6741,Learning concepts by asking questions. In R.S.
6767,Generalizing from case studies: A case study.
6771,Statistical tests for comparing supervised classification learning algorithms.
6775,Statistical evaluation of neural network experiments: Minimum requirements and current practice.
6782,"Oblivious decision trees, graphs and top-down pruning."
6784,A study of experimental evaluations of neural network learning algorithms: Current research practice.
6786,Bayesian model selection in social research.
6814,Factorial hidden Markov models.
6818,Exploiting tractable substructures in intractable networks.
6898,"""Bootstrap Confidence Intervals for Smoothing Splines and Their Comparison to Bayesian Confidence Intervals""."
6910,"Smoothing spline ANOVA for exponential families, with application to the Wisconsin Epidemiological Study of Diabetic Retinopathy."
6913,On the convergence properties of the EM algorithm.
6917,"""Covering vs. Divide-and-Conquer for Top-Down Induction of Logic Programs"","
6923,Inductive Constraint Logic.
6925,Solving the multiple-instance problem with axis-parallel rectangles.
6935,Inverse Entailment and Progol.
6939,Learning first-order definitions of functions.
6941,Multi-class problems and discretization in ICL (extended abstract).
7022,"Modularity in a connectionist model of morphology acquisition,"
7032,"Tibshirani (1994) Combining Estimates in Regression and Classification,"
7041,Bootstraping with Noise: An Effective Regularization Technique.
7047,"Learning one more thing,"
7272,Ocular dominance and patterned lateral connections in a self-organizing model of the primary visual cortex.
7276,"Self-organization and segmentation with laterally connected maps of spiking neurons. In Workshop on Self-Organizing Maps,"
7296,Modeling cortical plasticity based on adapting lateral interaction.
7297,"Self-organization and functional role of lateral connections and multi size receptive fields in the primary visual cortex. Neural Processing Letters,"
7419,Neuro-dynamic Programming.
7430,Multi-time models for temporally abstract planning.
7432,How to dynamically merge markov decision processes.
7532,"""Remarks on Finite Gain Stabilizability of Linear Systems Subject to Input Saturation,"""
7537,Global stabilization of linear systems with bounded feedback.
7867,Ellman. Knowledge-based re-engineering of legacy programs for robustness in automated design.
8079,Bias plus variance decomposition for zero-one loss functions.
8213,Robust reinforcement learning in motion planning.
8224,An empirical comparison of selection measures for decision-tree induction.
8581,Learning factorial codes by predictability minimization.
8591,Limits of control flow on parallelism.
8594,"Limits of Instruction-Level Parallelism,"
8617,"""A framework of combining symbolic and neural learning,"""
8619,An Anytime Approach to Connectionist Theory Refinement: Refining the Topologies of Knowledge-Based Neural Networks.
8687,The difficulties of learning logic programs with cut.
8696,The complexity of theory revision.
8699,Theory revision in fault hierarchies.
8703,Theory refinement combining analytical and empirical methods.
8766,Resource Spackling: A framework for integrating register allocation in local and global schedulers.
8821,"`A case study in machine learning\',"
8832,"`The possible contribution of AI to the avoidance of crises and wars: Using CBR methods with the KOSIMO database of conflicts\',"
8865,"""Using genetic algorithms to explore pattern recognition in the immune system,"""
8872,Efficient reinforcement learning through symbiotic evolution.
8874,A cooperative coevolutionary approach to function optimization.
8875,"""A Coevolutionary Approach to Learning Sequential Decision Rules"","
8961,Machine learning research: Four current directions.
9513,Long. On the complexity of learning from drifting distributions.
9515,Tracking drifting concepts by minimizing disagreements.
9559,A theory and methodology of machine learning.
9581,"De-Noising by soft thresholding,"
9586,"Adaptive Simulated Annealing (ASA),"
9708,"""Acquiring Recursive Concepts with Explanation-Based Learning,"""
9716,A formalization of explanation-based macro-operator learning.
10169,Dietterich (1991). Learning with Many Irrelevant Features.
10174,Knowing what doesn\'t matter: Exploiting (intentionally) omitted superfluous data.
10177,"Learning in the presence of malicious errors,"
10183,"""Concept learning and Heuristic Classification in Weak-Theory Domains,"""
10186,Learning default concepts.
10430,Rules and precedents as complementary warrants.
10435,Improving rule-based systems through case-based reasoning.
10531,Using dirichlet mixture priors to derive hidden Markov models for protein families.
10793,Learning finite state automata using local distinguishing experiments.
10796,Incremental induction of decision trees.
10798,"""Learning structural descriptions from examples."""
10981,"Acquiring the mapping from meaning to sounds. Connection Science,"
11093,"""Factorial learning and the EM algorithm"","
11148,Exploiting Choice: Instruction Fetch and Issue on an implementable Simultaneous Multithread-ing Processor.
11325,"""On Learning Multiple Descriptions of a Concept,"""
11326,What should be minimized in a decision tree?.
11335,Concept learning and the problem of small disjuncts.
11337,An Empirical Analysis of the Benefit of Decision Tree Size Biases as a Function of Concept Distribution.
11339,Exploring the decision forest: An empirical investigation of Occam\'s razor in decision tree induction.
11342,"On Pruning and Averaging Decision Trees,"
12155,Exact learning of -DNF formulas with malicious membership queries.
12158,Slonim. Learning monotone DNF with an in complete membership oracle.
12165,Slonim. The power of team exploration: Two robots can learn unlabeled directed graphs.
12169,Learning with unreliable boundary queries.
12182,"Warmuth ""How to use expert advice"","
12194,Learning from a consistently ignorant teacher.
12195,Efficient learning of typical finite automata from random walks.
12197,"Can pac learning algorithms tolerate random attribute noise? Algorithmica,"
12198,Exact identification of circuits using fixed points of amplification functions.
12199,Learning k-term DNF formulas with an incomplete membership oracle.
12210,Efficient distribution-free learning of probabilistic concepts.
12211,Learning from a population of hypotheses.
12238,Exactly learning automata with small cover time.
12247,Learning with queries but incomplete information.
12275,P (1997). Neural models for part whole hierarchies.
12330,"""Recognizing handwritten digits using mixtures of linear models"","
12337,A unified gradient-descent/clustering algorithm architecture for finite state machine induction.
12347,"""First-order vs. second-order single layer recurrent neural networks,"""
12350,Cryptographic limitations on learning boolean formulae and finite automata.
12359,Pruning recurrent neural networks for improved generalization performance.
12439,Improving the performance of radial basis function networks by learning center locations.
12558,"A trade network game with endogenous partner selection, Economic Report No."
12576,"""Learning sequential decision rules using simulation models and competition,"""
12631,"Smoothing spline ANOVA with component-wise Bayesian ""confidence intervals""."
12638,"Soft classification, a.k.a. risk estimation, via penalized log likelihood and smoothing spline analysis of variance."
12946,Supervised learning from incom plete data via an EM approach.
12960,Active learning with committees for text categorization.
13024,A hardware mechanism for dynamic reordering of memory references.
13136,(1995) Fast perceptual learning in hyperacuity.
13193,Reinforcement learning algorithm for partially observable Markov decision problems.
13195,Planning and acting in partially observable stochastic domains.
13205,"Mark (1992), Two Methods for Hierarchy Learning in Reinforcement Environments,"
13208,"Evolutionary principles in self-referential learning, or on learning how to learn: the meta-meta-..."
13212,Discovering solutions with low kolmogorov complexity and high generalization capability.
13213,"A general method for multi-agent reinforcement learning in unrestricted environments. In Adaptation, Coevolution and Learning in Multiagent Systems:"
13269,Monte-carlo reinforcement learning in non-Markovian decision problems.
13652,Brain-Structured Networks That Perceive and Learn.
13654,Coordination and Control Structures and Processes: Possibilities for Connectionist Networks.
13656,"Some Biases For Efficient Learning of Spatial, Temporal, and Spatio-Temporal Patterns."
13658,Generative Learning Structures for Generalized Connectionist Networks.
13686,"A Framework for Combining Symbolic and Neural Learning. In: Artificial Intelligence and Neural Networks: Steps Toward Principled Integration. Honavar,"
13717,Learning se-mantic grammars with constructive inductive logic programming.
13885,Learning controllers for industrial robots.
13917,Designing neural networks for adaptive control.
13960,Using a case-base of surfaces to speed-up reinforcement learning.
13966,A teaching method for memory-based control.
13972,Finding structure in reinforcement learning.
13982,Long. On-line learning with linear loss constraints.
14062,A formal analysis of the role of multi--point crossover in genetic algorithms.
14083,"`Data Reconciliation and Gross Error Detection for Dynamic Systems\',"
14090,",`Subregion-Adaptive Integration of Functions having a Dominant Peak\',"
14428,Belief revision in probability theory.
14429,From inheritance relation to non-axiomatic logic.
14430,Non-axiomatic reasoning system (version 2.2).
14431,An unified treatment of uncertainties.
14529,Concept learning and flexible weighting.
14531,Context-sensitive feature selection for lazy learners.
14545,"""A patient-adaptive neural network ECG patient monitoring algorithm"","
14549,Recognition and exploitation of contextual clues via incremental meta-learning.
14807,Exponentially many local minima for single neurons.
15076,An improved training algorithm for support vector machines.
15429,"""A General Lower Bound on the Number of Examples Needed for Learning,"""
15431,Long. A generalization of Sauer\'s lemma.
15670,Iterated prisoner\'s dilemma with choice and refusal of partners.
15889,Structural similarity as guidance in case-based design.
15892,"Automatic Indexing, Retrieval and Reuse of Topologies in Complex Designs."
15984,"""On the Markov equivalence of chain graphs, undirected graphs, and acyclic digraphs"","
15987,(1993) Linear dependencies represented by chain graphs.
16008,Graphical Models in Applied Multivariate Statistics.
16437,"""Learning context-free grammars: Limitations of a recurrent neural network with an external stack memory,"""
16451,"Using Recurrent Neural Networks to Learn the Structure of Interconnection Networks,"
16461,"""On the ap plicability of neural network and machine learning methodologies to natural language processing,"""
16470,"Giles P.C., and Collingwood, ""Finite state machines and recurrent neural networks -automata and dynamical systems approaches"","
16471,"""Constructing deterministic finite-state automata in recurrent neural networks"","
16474,"""Rule checking with recurrent neural networks,"""
16476,"Extraction of rules from discrete-time recurrent neural networks. Neural Networks,"
16485,On the Computational Power of Neural Nets.
16819,Markov chain Monte Carlo convergence diagnostics: A comparative review.
16843,"""Sampling from Multimodal Distributions Using Tempered Transitions,"""
17201,Scaling Up.
17208,Approximating optimal policies for partially observable stochastic domains.
17242,Detecting features in spatial point processes with clutter via model-based clustering.
17363,Logistic Response Projection Pursuit Regression.
17476,Markov games as a framework for multi-agent reinforcement learning.
17477,Co-evolving soccer softbot team coordination with genetic programming. In RoboCup-97: The first robot world cup soccer games and conferences.
17488,Incremental self-improvement for lifetime multi-agent reinforcement learning.
17798,Using Decision Trees to Improve Case-based Learning.
17811,Genetic algorithms as a tool for feature selection in machine learning.
17821,A game theoretic approach to moving horizon control.
18251,Lazy acquisition of place knowledge.
18313,Towards planning: Incremental investigations into adaptive robot control.
18532,"A remark on robust stabilization of general asymptotically controllable systems,"
18536,"""A `universal\' construction of Artstein\'s the orem on nonlinear stabilization,"""
18582,"""Knowledge-Based Genetic Learning"","
18615,Learning Trees and Rules with Set-valued Features.
18619,Heterogeneous uncertainty sampling for supervised learning.
18770,A guide to the literature on learning probabilistic networs from data.
18773,Build ing classifers using Bayesian networks.
18774,On the sample complexity of learning Bayesian networks.
18777,A tutorial on learning Bayesian networks.
18781,Learning to reason.
18785,On the hardness of approximate rea soning.
18811,Comparing Bayesian model class selection criteria by discrete finite mixtures.
18812,Constructing bayesian finite mixture models by the EM algorithm.
18815,Probabilistic instance-based learning.
18832,Reinforcement Learning: A Survey.
18833,Experiments on adding memory to XCS.
18834,A Study on the Generalization Capabilities of XCS.
19045,"""Automated WYSIWYG Design of both the topology and component val 223 ues of electrical circuits using genetic programming,"""
19231,"Query by Committee,"
19621,Self-organized formation of typologically correct feature maps.
19697,Keeping neural networks simple by minimizing the description length of the weights.
20178,Discovery of Physical Principles from Design Experiences.
20179,Use of Mental Models for Constraining Index Learning in Experience-Based Design.
20180,Learning indices for schema selection.
20193,The Structure-Mapping Engine: Algorithms and Examples.
20526,"""Self-improving factory simulation using continuous-time average reward reinforcement learning"" in Proceedings of the Fourteenth International Machine Learning Conference.,"
20528,Efficient Locally Weighted Polynomial Regression.
20534,"Reinforcement Learning for Job-Shop Scheduling,"
20584,Multivariate versus univariate decision trees.
20592,Learning non-linearly separable boolean functions with linear threshold unit trees and madaline-style networks.
20593,Generating Neural Networks Through the Induction of Threshold Logic Unit Trees (Extended Abstract).
20601,Learning conjunctions of Horn clauses.
20602,Learning Boolean read-once formulas with arbitrary symmetric and constant fan-in gates.
20821,"Top-down induction of logical decision trees,"
20833,Efficient specific-to-general rule induction.
20850,"Compression-Based Feature Subset Selection,"
20857,The ilp description learning problem: Towards a genearl model-leve definition of data mining in ilp.
20920,Comparing predictive inference methods for discrete domains.
20923,Bayesian Case-Based Reasoning with Neural Networks. Pp.
20924,"Massively parallel case-based reasoning with probabilistic similarity metrics. In Topics in Case-Based Reasoning,"
20942,(in press). Decision tree induction based on efficient tree restructuring.
20972,Exploratory Learning in the Game of GO: Initial Results.
22229,"""The Evolution of Agents that Build Mental Models and Create Simple Plans Using Genetic Programming,"""
22241,Simultaneous evolution of programs and their control structures.
22386,Paying attention to the right things: Issues of focus in case-based creative design.
22431,An investigation of noise-tolerant relational concept learning algorithms.
